{
  "schema": "prism.cli.compare_result.a0",
  "base": {
    "bundle_key": "d59a758370bd428e43a3482505c9273caa9a12353345fbc2fe5f3db8e8de0e07",
    "objects": 1200
  },
  "head": {
    "bundle_key": "0980ee7d3cc2cca05c0fb547aa0bf550aa174ddeffad8ea54eba3d8cd61cfdc1",
    "objects": 1210
  },
  "counts": {
    "added": 14,
    "removed": 4,
    "modified": 9,
    "unchanged": 1187,
    "ignored": 2,
    "base_objects": 1200,
    "head_objects": 1210
  }
}
